{
  "schema_name": "norad.report_receipt",
  "schema_version": "3.0.0",
  "record_type": "report_receipt",
  "run_id": "run_fixture",
  "attempt_id": "report-attempt-001",
  "generated_at": "2000-01-01T00:00:05Z",
  "publication_state": "complete",
  "transaction_state": "complete",
  "interpretation_boundary": "computational_candidates_only_biological_validation_outside_norad",
  "input_run_summary": {
    "path": "tests/fixtures/artifact_schema_v1/source/results/artifacts/run_fixture/run_fixture.run_summary.json",
    "sha256": "eeeeeeeeeeeeeeeeeeeeeeeeeeeeeeeeeeeeeeeeeeeeeeeeeeeeeeeeeeeeeeee",
    "schema_name": "norad.run_summary",
    "schema_version": "2.0.0"
  },
  "renderer": {
    "name": "Jinja2",
    "version": "3.1.6"
  },
  "template": {
    "path": "norad.reporting/templates/run_report.html.j2",
    "sha256": "ffffffffffffffffffffffffffffffffffffffffffffffffffffffffffffffff"
  },
  "stylesheet": {
    "path": "norad.reporting/styles/run_report.css",
    "sha256": "abababababababababababababababababababababababababababababababab"
  },
  "outputs": [
    {
      "output_id": "run_report_html",
      "kind": "html",
      "path": "results/reports/run_fixture/run_fixture.run_report.html",
      "sha256": "1212121212121212121212121212121212121212121212121212121212121212",
      "size_bytes": 4096,
      "media_type": "text/html",
      "self_contained": true
    },
    {
      "output_id": "run_summary_tsv",
      "kind": "run_summary_tsv",
      "path": "results/reports/run_fixture/run_fixture.run_summary.tsv",
      "sha256": "1414141414141414141414141414141414141414141414141414141414141414",
      "size_bytes": 512,
      "media_type": "text/tab-separated-values"
    }
  ],
  "state_banner": "COMPUTATIONAL RESULTS — BIOLOGICAL VALIDATION IS OUTSIDE NORAD.",
  "truncations": [
    {
      "table_id": "cmh_ranked_candidates",
      "report_section": "candidate_summary",
      "full_table_path": "results/editing/synthetic_analysis/synthetic_analysis.cmh_all_sites.tsv",
      "full_table_sha256": "6666666666666666666666666666666666666666666666666666666666666666",
      "full_row_count": 100,
      "displayed_row_count": 10
    }
  ],
  "schema_versions": {
    "artifact_record": "2.0.0",
    "run_summary": "2.0.0",
    "report_receipt": "3.0.0"
  },
  "analysis_execution_performed": false,
  "external_network_assets_used": false,
  "validation_claimed": false,
  "warnings": [
    {
      "code": "synthetic_fixture",
      "message": "The report is a rendering of synthetic computational evidence.",
      "related_artifact_ids": [],
      "evidence": []
    }
  ],
  "errors": [],
  "provenance": {
    "producer": "artifact_schema_fixture",
    "producer_version": "2.0.0",
    "git_commit": "fixturecommit",
    "created_at": "2000-01-01T00:00:05Z"
  }
}
